{
  "$schema": "http://json-schema.org/draft-07/schema#",
  "$id": "https://portico/asistente/ficha.schema.json",
  "title": "Ficha estructurada PÓRTICO",
  "description": "Especificación acotada que el LLM rellena a partir del lenguaje natural. NO contiene geometría nodo-a-nodo ni valores de ingeniería: el generador determinista los deriva de esta ficha + reglas.json + bibliotecas CSV.",
  "type": "object",
  "required": ["modo", "geometria"],
  "additionalProperties": false,
  "properties": {
    "proyecto": { "type": "string", "description": "Nombre del proyecto." },
    "modo": { "type": "string", "enum": ["2D", "3D"], "description": "2D = pórtico plano X–Z (sin ejes Y)." },
    "tipologia": {
      "type": "string",
      "enum": ["marco", "muros_madera", "cercha"],
      "default": "marco",
      "description": "marco = pórtico de pilares y vigas (acero/hormigón). muros_madera = entramado ligero de madera (tabiques con pies derechos + soleras + viguetas de piso). cercha = cercha/celosía de techo a dos aguas tipo Warren (rellene 'cercha')."
    },

    "ubicacion": {
      "type": "object",
      "additionalProperties": false,
      "description": "Para cargas dependientes de ubicación (nieve, viento, sismo).",
      "properties": {
        "ciudad": { "type": "string" },
        "latitud_sur_deg": { "type": "number", "minimum": 17, "maximum": 56 },
        "altitud_msnm": { "type": "number", "minimum": 0 },
        "exposicion": { "type": "string", "enum": ["B", "C", "D"], "default": "C" }
      }
    },

    "geometria": {
      "type": "object",
      "required": ["niveles"],
      "additionalProperties": false,
      "properties": {
        "niveles": {
          "type": "array",
          "minItems": 1,
          "description": "Un objeto por piso, de abajo hacia arriba. Cada nivel puede tener distinta altura y distinto uso/cargas (ej. nivel 1 salas de clases, nivel 3 bodegas livianas).",
          "items": {
            "type": "object",
            "required": ["altura_m"],
            "additionalProperties": false,
            "properties": {
              "altura_m": { "type": "number", "exclusiveMinimum": 0 },
              "uso_NCh1537": { "type": "string", "description": "Uso de ESTE nivel (override de cargas.uso_NCh1537). Ej. 'Escuelas/Salas de Clases', 'Bodegas/Livianas'." },
              "sobrecarga_uso_kN_m2": { "type": "number", "minimum": 0, "description": "Override explícito de sobrecarga de uso de este nivel." },
              "muerta_adicional_kN_m2": { "type": "number", "minimum": 0, "description": "Carga muerta de área de este nivel (override)." }
            }
          }
        },
        "vanos_x": {
          "description": "Vanos en X: lista de luces [3,3,3,4] o uniforme {cantidad, luz_m}. Alternativa a planta_inferior.Lx_m / ejes_x_m.",
          "oneOf": [
            { "type": "array", "items": { "type": "number", "exclusiveMinimum": 0 }, "minItems": 1 },
            { "type": "object", "additionalProperties": false, "required": ["cantidad", "luz_m"], "properties": { "cantidad": { "type": "integer", "minimum": 1 }, "luz_m": { "type": "number", "exclusiveMinimum": 0 } } }
          ]
        },
        "vanos_y": {
          "description": "Vanos en Y (3D): lista de luces o uniforme {cantidad, luz_m}.",
          "oneOf": [
            { "type": "array", "items": { "type": "number", "exclusiveMinimum": 0 }, "minItems": 1 },
            { "type": "object", "additionalProperties": false, "required": ["cantidad", "luz_m"], "properties": { "cantidad": { "type": "integer", "minimum": 1 }, "luz_m": { "type": "number", "exclusiveMinimum": 0 } } }
          ]
        },
        "planta_inferior": {
          "type": "object",
          "additionalProperties": false,
          "description": "Dimensiones de planta (alternativa a vanos_x/vanos_y o ejes). Define al menos una vía de geometría por dirección.",
          "properties": {
            "Lx_m": { "type": "number", "exclusiveMinimum": 0 },
            "Ly_m": { "type": "number", "exclusiveMinimum": 0, "description": "Requerido en 3D." }
          }
        },
        "planta_superior": {
          "type": "object",
          "additionalProperties": false,
          "description": "Si se omite, igual a la inferior (planta constante). Si difiere, el generador interpola linealmente entre niveles.",
          "properties": {
            "Lx_m": { "type": "number", "exclusiveMinimum": 0 },
            "Ly_m": { "type": "number", "exclusiveMinimum": 0 }
          }
        },
        "ejes_x_m": { "type": "array", "items": { "type": "number" }, "description": "Coordenadas de ejes en X (opcional). Si se omite, el generador subdivide Lx por separacion_maxima_vano_m." },
        "ejes_y_m": { "type": "array", "items": { "type": "number" }, "description": "Coordenadas de ejes en Y (opcional, ignorado en 2D)." },
        "ancho_tributario_m": { "type": "number", "exclusiveMinimum": 0, "description": "Solo en 2D: separación entre pórticos para repartir cargas de área a líneas." },
        "pendiente_techo_deg": { "type": "number", "minimum": 0, "maximum": 90, "default": 0, "description": "Pendiente del techo (grados); afecta Cs (nieve) y GCpf (viento)." }
      }
    },

    "secciones": {
      "type": "object",
      "required": ["material", "vigas", "pilares"],
      "additionalProperties": false,
      "properties": {
        "material": { "type": "string", "description": "Acero (S235/S275/S355/A630-420H) u hormigón (H20/H25/H30/H40). fc en MPa → H{fc}, ej. fc=30 → 'H30'." },
        "vigas": { "$ref": "#/$defs/seccion", "description": "Perfil de acero (string, ej. 'IPE300') o sección rectangular de hormigón {b_cm,h_cm}." },
        "pilares": { "$ref": "#/$defs/seccion", "description": "Perfil de acero (string, ej. 'HEB200') o sección rectangular de hormigón {b_cm,h_cm}." }
      }
    },

    "apoyo_base": { "type": "string", "enum": ["empotrado", "rotulado"], "default": "empotrado" },
    "diafragma_rigido": { "type": "boolean", "default": true },

    "cargas": {
      "type": "object",
      "additionalProperties": false,
      "properties": {
        "muerta_adicional_kN_m2": { "type": "number", "minimum": 0, "description": "Carga muerta de área además del peso propio (losa, terminaciones)." },
        "uso_NCh1537": { "type": "string", "description": "Descripción de uso en sobrecargas_NCh1537.csv (ej. 'Escuelas/Salas de Clases')." },
        "sobrecarga_uso_kN_m2": { "type": "number", "minimum": 0, "description": "Override explícito de sobrecarga de uso (kN/m²); si se da, prevalece sobre uso_NCh1537." },
        "cierre_viento": { "type": "string", "enum": ["Abierto", "Parcialmente cerrado", "Cerrado"], "default": "Cerrado", "description": "Condición de cierre del edificio (GCpi de viento)." },
        "proteccion_nieve": { "type": "string", "enum": ["Totalmente expuesto", "Parcialmente expuesto", "Protegido"], "default": "Parcialmente expuesto", "description": "Grado de protección del techo (Ce de nieve)." },
        "nieve": { "type": "boolean", "default": false },
        "viento": { "type": "boolean", "default": false },
        "sismo": { "type": "boolean", "default": false }
      }
    },

    "sismo": {
      "type": "object",
      "additionalProperties": false,
      "description": "Parámetros NCh433/DS61 para los casos espectrales (si cargas.sismo = true).",
      "properties": {
        "zona": { "type": "integer", "enum": [1, 2, 3] },
        "suelo": { "type": "string", "enum": ["A", "B", "C", "D", "E"] },
        "categoria": { "type": "string", "enum": ["I", "II", "III", "IV"] },
        "R": { "type": "number", "exclusiveMinimum": 0 }
      }
    },

    "tabiques": {
      "type": "object",
      "additionalProperties": false,
      "description": "Solo tipologia = 'muros_madera'. Entramado de tabiques: pies derechos verticales + soleras (inferior/superior). La planta (geometria.planta_inferior Lx_m, Ly_m) define el perímetro.",
      "properties": {
        "escuadria": { "type": "string", "description": "Escuadría del pie derecho en pulgadas, ej. '2x4', '2x6'. También acepta {b_cm,h_cm} pero lo normal es la escuadría comercial." },
        "separacion_m": { "type": "number", "exclusiveMinimum": 0, "default": 0.4, "description": "Separación entre pies derechos (ej. 0.4 = @40 cm)." },
        "perimetro": { "type": "boolean", "default": true, "description": "Generar los 4 muros perimetrales en cada nivel." },
        "diagonales": { "type": "boolean", "default": true, "description": "Agregar diagonales de arriostramiento (en zigzag) a los tabiques." },
        "diagonal_tramos": { "type": "integer", "minimum": 2, "default": 3, "description": "Nº de tramos entre pies derechos que abarca cada diagonal (3 tramos = cruza 2 pies derechos)." },
        "interiores": {
          "type": "array",
          "description": "Tabiques interiores. Cada uno es una línea en planta con aberturas opcionales (puertas/ventanas).",
          "items": {
            "type": "object",
            "additionalProperties": false,
            "required": ["dir", "pos_m"],
            "properties": {
              "nivel": { "type": "integer", "minimum": 1, "default": 1, "description": "Nivel en que se ubica el tabique (1 = primer piso)." },
              "dir": { "type": "string", "enum": ["X", "Y"], "description": "Dirección de la línea del tabique en planta." },
              "pos_m": { "type": "number", "minimum": 0, "description": "Coordenada perpendicular del tabique (si dir=Y, es la X; si dir=X, es la Y). 'centro' ≈ L/2." },
              "aberturas": {
                "type": "array",
                "items": {
                  "type": "object",
                  "additionalProperties": false,
                  "required": ["ancho_m"],
                  "properties": {
                    "tipo": { "type": "string", "enum": ["puerta", "ventana"], "default": "puerta" },
                    "ancho_m": { "type": "number", "exclusiveMinimum": 0, "description": "Ancho del vano (ej. 0.8 = puerta de 80 cm)." },
                    "alto_m": { "type": "number", "exclusiveMinimum": 0, "default": 2.0, "description": "Alto del vano (dintel) desde la base del tabique." },
                    "centro_m": { "type": "number", "minimum": 0, "description": "Posición del centro del vano a lo largo de la línea del tabique. Si se omite, al centro del muro." }
                  }
                }
              }
            }
          }
        }
      }
    },

    "entrepisos": {
      "type": "object",
      "additionalProperties": false,
      "description": "Solo tipologia = 'muros_madera'. Viguetas de piso/techo apoyadas en los muros.",
      "properties": {
        "escuadria": { "type": "string", "description": "Escuadría de la vigueta en pulgadas, ej. '2x8', '2x10'." },
        "separacion_m": { "type": "number", "exclusiveMinimum": 0, "default": 0.6, "description": "Separación entre viguetas (ej. 0.6 = @60 cm)." },
        "dir": { "type": "string", "enum": ["X", "Y"], "default": "X", "description": "Dirección en que corren las viguetas (apoyadas en los muros perpendiculares)." }
      }
    },

    "techo": {
      "type": "object",
      "additionalProperties": false,
      "description": "Solo tipologia = 'muros_madera'. Techo del edificio. Por defecto plano (viguetas). Con tipo 'cercha' corona el edificio con cerchas Warren a dos aguas integradas sobre los muros.",
      "properties": {
        "tipo": { "type": "string", "enum": ["plano", "cercha"], "default": "plano", "description": "plano = plataforma de viguetas; cercha = cerchas Warren a dos aguas." },
        "pendiente_pct": { "type": "number", "minimum": 0, "default": 10, "description": "Pendiente del techo en % (solo tipo cercha)." },
        "altura_cumbrera_m": { "type": "number", "exclusiveMinimum": 0, "description": "Altura de cumbrera (override de pendiente_pct)." },
        "separacion_m": { "type": "number", "exclusiveMinimum": 0, "default": 0.6, "description": "Separación entre cerchas." },
        "dir": { "type": "string", "enum": ["X", "Y"], "description": "Dirección en que las cerchas salvan la luz. Si se omite, salvan el lado más corto." },
        "n_paneles": { "type": "integer", "minimum": 2, "description": "Nº de paneles de cada cercha (par)." },
        "escuadria_cordon": { "type": "string", "description": "Escuadría de cordones, ej. '2x6'." },
        "escuadria_diagonal": { "type": "string", "description": "Escuadría de diagonales, ej. '2x4'." }
      }
    },

    "cercha": {
      "type": "object",
      "additionalProperties": false,
      "description": "Solo tipologia = 'cercha'. Cercha de techo a dos aguas tipo Warren (celosía triangulada, diagonales en zigzag). Se genera UNA cercha plana representativa (plano X–Z), cargada por su ancho tributario (separacion_m).",
      "properties": {
        "luz_m": { "type": "number", "exclusiveMinimum": 0, "default": 6, "description": "Luz total entre apoyos (m)." },
        "pendiente_pct": { "type": "number", "minimum": 0, "default": 10, "description": "Pendiente del techo en % (10 = 10%). Alternativa: altura_cumbrera_m." },
        "altura_cumbrera_m": { "type": "number", "exclusiveMinimum": 0, "description": "Altura de la cumbrera sobre los apoyos (override de pendiente_pct)." },
        "n_paneles": { "type": "integer", "minimum": 2, "default": 8, "description": "Nº de paneles del cordón inferior (par, para que coincida la cumbrera)." },
        "separacion_m": { "type": "number", "exclusiveMinimum": 0, "default": 0.6, "description": "Separación entre cerchas (ancho tributario de carga; ej. 0.6 = @60 cm)." },
        "escuadria_cordon": { "type": "string", "description": "Escuadría de los cordones (superior e inferior), ej. '2x6'." },
        "escuadria_diagonal": { "type": "string", "description": "Escuadría de diagonales/montantes, ej. '2x4'." }
      }
    }
  },

  "$defs": {
    "seccion": {
      "oneOf": [
        { "type": "string", "description": "Nombre de perfil de acero en perfiles.csv (ej. 'IPE300', 'HEB200'). También admite 'b x h' en cm." },
        {
          "type": "object",
          "additionalProperties": false,
          "required": ["b_cm", "h_cm"],
          "description": "Sección rectangular maciza (hormigón): b = ancho, h = canto.",
          "properties": {
            "b_cm": { "type": "number", "exclusiveMinimum": 0 },
            "h_cm": { "type": "number", "exclusiveMinimum": 0 },
            "nombre": { "type": "string" }
          }
        }
      ]
    }
  }
}
